{
  "id": "watchtower",
  "scenarios": ["s4"],
  "edge": "tower",
  "surface": "worn-stone",
  "boundary": "walls",
  "ground": { "texture": "cave-rock", "tint": "#646068", "scale": 2.2 },
  "walls": { "height": 1.8, "low": 0.32, "alt": 3, "inner": "#8c8886", "sconce": { "piece": "wall-torch", "every": 4 } },
  "palette": { "stone": "#7c7876", "stoneDark": "#4e4b4d", "stoneLight": "#86817c", "glowCold": "#9fb4d8", "banner": "#3f2452", "crystal": "#8a62d0" },
  "light": {
    "sky": "#a8b0d0",
    "ground": "#2a2632",
    "hemi": 0.65,
    "sun": "#d0d4f0",
    "sunIntensity": 1.35,
    "env": 0.45,
    "point": { "color": "#ff9a44", "intensity": 7, "distance": 7 }
  },
  "fog": { "color": "#1a1a24", "glow": "#2a2438", "start": 2.4, "end": 7, "morok": "#a8a8c0", "morokOpacity": 0.4 },
  "entrance": null,
  "propModels": {
    "barrel": { "model": "barrel", "height": 0.92 },
    "crate": { "model": "crate", "height": 0.62 },
    "table": { "model": "tavern-table", "height": 0.8 },
    "rune": { "model": "rune-stone", "height": 0.7 },
    "chest": { "model": "chest", "height": 0.6 },
    "door": { "model": "dungeon-door", "height": 1.0 },
    "trap": { "model": "bear-trap", "height": 0.18 }
  },
  "dressing": {
    "ring": [["crate", 2], ["barrel", 2], ["banner", 2], ["torch", 2], ["rubble", 2], ["weapon-rack", 2], ["sacks", 1], ["crate-stack", 1]],
    "density": 0.7
  }
}
