{
  "id": "gloom-heart",
  "scenarios": ["s5"],
  "edge": "cave",
  "surface": "rock",
  "boundary": "rocks",
  "ground": { "texture": "cave-rock", "tint": "#4e4a56", "scale": 3.0 },
  "walls": { "height": 1.9, "low": 0.4, "alt": 3, "inner": "#5c5866" },
  "palette": { "rock": "#5e5a66", "rockDark": "#3c3944", "crystal": "#9c6ae2", "moss": "#4e5a52", "glowCold": "#7ad0e8" },
  "light": {
    "sky": "#8c88b8",
    "ground": "#1c1a26",
    "hemi": 0.6,
    "sun": "#b0b8f0",
    "sunIntensity": 1.15,
    "env": 0.3,
    "point": { "color": "#a884ff", "intensity": 5, "distance": 7 }
  },
  "fog": { "color": "#121119", "glow": "#241d36", "start": 2.6, "end": 8.5, "morok": "#9c9cb4", "morokOpacity": 0.5 },
  "entrance": null,
  "propModels": {
    "brazier": { "model": "brazier", "height": 0.8 },
    "brazier-lit": { "model": "brazier", "height": 0.8 },
    "chest": { "model": "chest", "height": 0.6 },
    "door": { "model": "dungeon-door", "height": 1 },
    "trap": { "model": "bear-trap", "height": 0.18 },
    "crystals": { "model": "crystal-cluster", "height": 0.7 },
    "rubble-heap": { "model": "rubble-pile", "height": 0.55 },
    "cage": { "model": "prisoner-cage", "height": 1.1 },
    "totem": { "model": "tribal-totem", "height": 1.5 },
    "crystal": { "model": "crystal-cluster", "height": 0.7 }
  },
  "dressing": {
    "ring": [["stalagmite", 3], ["rock", 3], ["crystals", 2], ["glow-mushrooms", 2]],
    "outside": [["stalagmite", 2], ["rock", 2], ["crystals", 1]],
    "far": [["stalagmite-big", 3]],
    "density": 0.7
  }
}
