{
  "id": "cellar",
  "scenarios": ["s1"],
  "edge": "stone",
  "surface": "flagstones",
  "boundary": "walls",
  "ground": { "texture": "tavern-planks", "tint": "#5e4434", "scale": 2.4 },
  "walls": { "height": 1.6, "low": 0.3, "alt": 3, "inner": "#a08c76" },
  "palette": { "stone": "#94806b", "stoneDark": "#62524a", "stoneLight": "#a8927a", "wood": "#8c5c36", "woodDark": "#5a3b24" },
  "light": {
    "sky": "#ffe2b6",
    "ground": "#3c2c22",
    "hemi": 0.9,
    "sun": "#ffd6a0",
    "sunIntensity": 1.75,
    "env": 0.35,
    "point": { "color": "#ffac58", "intensity": 5, "distance": 6 }
  },
  "fog": { "color": "#1d1612", "glow": "#2c2018", "start": 2.0, "end": 6, "morok": "#aba8b2", "morokOpacity": 0.35 },
  "entrance": "stairs",
  "propModels": {
    "barrel": { "model": "barrel", "height": 0.92 },
    "crate": { "model": "crate", "height": 0.62 },
    "sack": { "model": "flour-sack", "height": 0.5 },
    "chest": { "model": "chest", "height": 0.6 },
    "door": { "model": "dungeon-door", "height": 1.0 },
    "trap": { "model": "bear-trap", "height": 0.18 }
  },
  "dressing": {
    "ring": [["barrel", 3], ["keg-rack", 2], ["crate", 2], ["crate-stack", 2], ["sacks", 2], ["wine-rack", 2], ["candles", 2], ["shelf", 1], ["sack", 1]],
    "density": 0.75
  }
}
